{
  "$schema": "../schemas/demo1-service-corpus.schema.json",
  "schema_version": "1.0.0",
  "corpus_id": "demo1-bank-service-corpus",
  "source_contract": {
    "contract_id": "demo1-service-corpus-contract",
    "source_document_path": "demo1-deep-research-agent/examples/generated-bank-strategy/bank-strategy-report.pdf",
    "source_document_sha256": "02d03b56361b8eed4ae6fa0ee594f46a0b6096e9e82bb5073a73bd218e133ad3",
    "source_document_page_count": 5,
    "separate_from_policy_connection": true,
    "forbidden_publish_connections": [
      "kb-acme-bank-foundryiq"
    ],
    "project_endpoint": "https://4iq-foundry-project-resource.services.ai.azure.com/api/projects/4iq-foundry-project",
    "notes": "Separate reviewed-content corpus for Demo 1 service discovery assets. Never overwrite the bank policy knowledge base."
  },
  "record_version": 5,
  "review": {
    "state": "published",
    "updated_at": "2026-08-04T14:20:00Z",
    "updated_by": "publisher.bot@example.com",
    "history": [
      {
        "from_state": null,
        "to_state": "draft",
        "timestamp": "2026-08-04T13:45:00Z",
        "actor": "content.seed.generator",
        "note": "Initial synthetic staging manifest created from Demo 1 outputs."
      },
      {
        "from_state": "draft",
        "to_state": "pending_review",
        "timestamp": "2026-08-04T14:00:00Z",
        "actor": "qc.runner@example.com",
        "note": "Automated validation passed and the corpus was queued for editorial review."
      },
      {
        "from_state": "pending_review",
        "to_state": "approved",
        "timestamp": "2026-08-04T14:12:00Z",
        "actor": "content.editor@example.com",
        "note": "Editorial review approved the synthetic service corpus for publication planning."
      },
      {
        "from_state": "approved",
        "to_state": "published",
        "timestamp": "2026-08-04T14:20:00Z",
        "actor": "publisher.bot@example.com",
        "note": "Publish plan executed against the dedicated Demo 1 service corpus targets."
      }
    ],
    "qc_summary": {
      "status": "passed",
      "checks": {
        "citations_complete": true,
        "image_provenance_complete": true,
        "version_hashes_verified": true,
        "feedback_links_verified": true
      }
    }
  },
  "publication": {
    "blob_container": "bank-servicing-content",
    "blob_prefix": "demo1-service-corpus/2026-08-04.1",
    "foundry_iq_connection_name": "svc-demo1-bank-services-foundryiq",
    "publish_state": "published",
    "published_at": "2026-08-04T14:20:00Z"
  },
  "source_artifacts": [
    {
      "artifact_id": "src-pdf-bank-strategy",
      "relative_path": "demo1-deep-research-agent/examples/generated-bank-strategy/bank-strategy-report.pdf",
      "kind": "document",
      "mime_type": "application/pdf",
      "sha256": "02d03b56361b8eed4ae6fa0ee594f46a0b6096e9e82bb5073a73bd218e133ad3",
      "size_bytes": 11386,
      "page_count": 5,
      "provenance": {
        "origin": "demo1-generated-asset",
        "generator": "deep-research-agent",
        "license": "synthetic-internal-demo"
      }
    },
    {
      "artifact_id": "src-image-hero",
      "relative_path": "demo1-deep-research-agent/examples/generated-bank-strategy/bank-hero.png",
      "kind": "image",
      "mime_type": "image/png",
      "sha256": "86b67df4b32f845854bd39c0784092759d219e59dc18f0e5fdda60dbcdbc4f8f",
      "size_bytes": 2141932,
      "width": 1440,
      "height": 960,
      "provenance": {
        "origin": "demo1-generated-asset",
        "generator": "deep-research-agent",
        "license": "synthetic-internal-demo"
      }
    },
    {
      "artifact_id": "src-image-priorities",
      "relative_path": "demo1-deep-research-agent/examples/generated-bank-strategy/service-priorities.svg",
      "kind": "image",
      "mime_type": "image/svg+xml",
      "sha256": "4cad29ba7c7e8d32191df8c0c6db99fa83919604806502c0d0329bea7d2480ef",
      "size_bytes": 1394,
      "provenance": {
        "origin": "demo1-generated-asset",
        "generator": "deep-research-agent",
        "license": "synthetic-internal-demo"
      }
    },
    {
      "artifact_id": "src-audio-narration",
      "relative_path": "demo1-deep-research-agent/examples/generated-bank-strategy/services-narration.wav",
      "kind": "audio",
      "mime_type": "audio/wav",
      "sha256": "80144a3ca3a04c33a5524c04e41fb37fc83ef581068c2ee82e13a48b00566346",
      "size_bytes": 5347844,
      "duration_seconds": 33.4,
      "provenance": {
        "origin": "demo1-generated-asset",
        "generator": "deep-research-agent",
        "license": "synthetic-internal-demo"
      }
    }
  ],
  "citations": [
    {
      "citation_id": "citation-p1-portfolio",
      "artifact_id": "src-pdf-bank-strategy",
      "locator": {
        "page": 1,
        "line_range": [
          1,
          12
        ]
      },
      "quote": "Synthetic executive summary describing a customer-first banking service portfolio."
    },
    {
      "citation_id": "citation-p2-services",
      "artifact_id": "src-pdf-bank-strategy",
      "locator": {
        "page": 2,
        "line_range": [
          1,
          18
        ]
      },
      "quote": "Synthetic service matrix covering checking, savings, lending, and advisory offers."
    },
    {
      "citation_id": "citation-p3-journeys",
      "artifact_id": "src-pdf-bank-strategy",
      "locator": {
        "page": 3,
        "line_range": [
          4,
          22
        ]
      },
      "quote": "Synthetic customer journey guidance for branch, mobile, and advisor-assisted servicing."
    },
    {
      "citation_id": "citation-hero-image",
      "artifact_id": "src-image-hero",
      "locator": {
        "region": "full-image"
      },
      "quote": "Synthetic bank lobby hero image used for reviewed service merchandising."
    },
    {
      "citation_id": "citation-priority-diagram",
      "artifact_id": "src-image-priorities",
      "locator": {
        "region": "full-image"
      },
      "quote": "Synthetic service priority diagram for top discovery scenarios."
    }
  ],
  "extracted_text": [
    {
      "chunk_id": "chunk-exec-summary",
      "artifact_id": "src-pdf-bank-strategy",
      "page": 1,
      "section_title": "Executive Summary",
      "text": "ACME Bank packages everyday banking, advisory, and lending support into service cards designed for omnichannel discovery.",
      "citations": [
        "citation-p1-portfolio"
      ]
    },
    {
      "chunk_id": "chunk-service-bundles",
      "artifact_id": "src-pdf-bank-strategy",
      "page": 2,
      "section_title": "Service Bundles",
      "text": "The reviewed service catalog highlights Checking 360, Savings Builder, Refinance Assist, and Wealth Insights as the primary experiences surfaced to customers.",
      "citations": [
        "citation-p2-services"
      ]
    },
    {
      "chunk_id": "chunk-channel-journeys",
      "artifact_id": "src-pdf-bank-strategy",
      "page": 3,
      "section_title": "Customer Journeys",
      "text": "Service descriptions align mobile self-service, branch escalation, and advisor follow-up into one handoff-aware servicing journey.",
      "citations": [
        "citation-p3-journeys"
      ]
    }
  ],
  "image_metadata": [
    {
      "image_id": "img-source-hero",
      "artifact_id": "src-image-hero",
      "caption": "Synthetic retail banking hero art for service discovery.",
      "provenance": {
        "source_type": "demo1-generated-asset",
        "created_by": "deep-research-agent",
        "prompt_hash": "sha256:hero-source-asset",
        "reviewed_by": null,
        "reviewed_at": null
      },
      "citations": [
        "citation-hero-image"
      ]
    },
    {
      "image_id": "img-source-priorities",
      "artifact_id": "src-image-priorities",
      "caption": "Synthetic vector diagram of service priorities.",
      "provenance": {
        "source_type": "demo1-generated-asset",
        "created_by": "deep-research-agent",
        "prompt_hash": "sha256:priority-source-asset",
        "reviewed_by": null,
        "reviewed_at": null
      },
      "citations": [
        "citation-priority-diagram"
      ]
    }
  ],
  "generated_flux_media": [
    {
      "media_id": "flux-checking-visual-v1",
      "storage_path": "generated/flux/checking-360-v1.png",
      "media_type": "image/png",
      "prompt_hash": "sha256:flux-checking-360-v1",
      "model_deployment": "flux-1.1-pro",
      "derived_from_version_id": "svc-desc-2026-08-04-v2",
      "citations": [
        "citation-p2-services",
        "citation-hero-image"
      ],
      "provenance": {
        "source": "synthetic-flux-output",
        "reviewed_by": "content.editor@example.com",
        "approval_timestamp": "2026-08-04T14:10:00Z"
      }
    }
  ],
  "feedback_lineage": [
    {
      "feedback_id": "feedback-v1-tone",
      "source_version_id": "svc-desc-2026-07-31-v1",
      "derived_version_id": "svc-desc-2026-08-04-v2",
      "submitted_by_role": "content_reviewer",
      "submitted_at": "2026-08-04T12:15:00Z",
      "summary": "Simplify product phrasing and tighten channel-specific callouts."
    }
  ],
  "synthetic_account_opening_drafts": [
    {
      "draft_id": "acct-open-draft-001",
      "applicant_alias": "Taylor Rivera",
      "product_name": "Checking 360",
      "service_version_id": "svc-desc-2026-08-04-v2",
      "status": "draft",
      "citations": [
        "citation-p2-services",
        "citation-p3-journeys"
      ],
      "kyc_notes": "Synthetic applicant journey for branch-assisted onboarding with digital document upload."
    },
    {
      "draft_id": "acct-open-draft-002",
      "applicant_alias": "Jordan Lee",
      "product_name": "Savings Builder",
      "service_version_id": "svc-desc-2026-08-04-v2",
      "status": "draft",
      "citations": [
        "citation-p2-services"
      ],